hidden_object,observed_margin,synthetic_signal,identification_design,remaining_threat,welfare_object
effort,within-worker output change under performance pay,14.9955,contract change with workers observed before and after,"learning, task assignment, or demand shocks may also raise output",productivity net of worker cost and risk
type,difference between raw output gap and within-worker change,1.1375,"separate incumbents, exits, and entrants",entry and exit can respond to unobserved outside options,"match quality, retention, and distribution of gains"
risk_sharing,pay dispersion before and after performance pay,3.564,compare pay variance and average pay under contract regimes,pay variance mixes risk exposure and productivity heterogeneity,worker insurance and surplus
multitasking,measured-task share and quality under the new contract,task_share_gap=0.1532; quality_gap=-0.0297,track rewarded and unrewarded performance dimensions,quality may be measured noisily or with delay,"true organizational output, not only measured units"
subjective_evaluation_influence,influence activity and ratings when evaluator identity is known,0.1828,evaluator rotation or random evaluator assignment,known evaluators may also have better information,"public-service output, fairness, and promotion quality"
commitment,"contract take-up, attendance, and target completion",not directly observed in the performance-pay panel,randomized contract menu or commitment-framing experiment,commitment demand can be confounded with liquidity and risk preferences,worker surplus from discipline versus coercive effort extraction
