project,rule,mechanism,labor_margin,counterfactual,main_spillover,welfare_object
platform ranking pilot,change worker visibility in search results,attention and information,"views, bids, hires, wages",old ranking rule,attention shifts away from untreated workers,worker surplus and employer match quality
recruiting timing reform,ban exploding offers or coordinate offer dates,timing and congestion,"interviews, acceptances, vacancy fill, match quality",decentralized early offers,firms may move screening earlier or use informal promises,worker option value and employer staffing
pay transparency rollout,require posted wage ranges,information and bargaining,"applications, wage offers, acceptance, sorting",no posting requirement,employers may compress ranges or change vacancy text,"worker wages, sorting, and surplus incidence"
teacher placement reform,centralize assignment with school priorities,matching under public staffing constraints,"preference rank, hard-to-staff fill, retention",decentralized hiring or old priority rule,schools and teachers may change ranking behavior,"teacher welfare, student access, and public staffing"
internal assignment market,introduce ranked internal job bidding,within-firm mobility and information,"transfers, promotions, retention, productivity",manager-directed assignment,managers may retain workers strategically,worker career value and firm productivity
AI screening audit,algorithmic shortlist for applicants,screening and information aggregation,"callbacks, interviews, offers, match quality",human screening or old score rule,applicants and employers may adapt resumes and criteria,"access, match quality, and distributional fairness"
