case_id,anchor,reform_family,identifying_variation,observed_margin,primary_bottleneck,secondary_bottleneck,welfare_margin,interpretation_risk,diagnostic_next_step
south_africa_legal_information,Bertrand-Crepon 2021,legal_information,randomized labor-law information treatment,"legal knowledge, perceived enforcement, formal contract, employment",worker and firm knowledge or beliefs,firm_adaptation,"take-up, bargaining power, and information quality",medium interpretation risk,Measure whether actors know the rule and believe it can be invoked.
brazil_enforcement_informality,Almeida-Carneiro 2012,enforcement_expansion,local enforcement intensity,"informality, compliance, wages, employment",state capacity and local implementation,informality_evasion,"incidence, displacement, and uncovered-worker spillovers",medium interpretation risk,"Measure inspectors, courts, records, sanctions, and local administrative reach."
wrongful_discharge_state_adoption,Autor-Donohue-Schwab 2004,dismissal_protection,staggered state adoption of wrongful-discharge doctrines,"employment, hiring, firing, turnover",legal coverage and exposure,firm_adaptation,employment security versus hiring and entry margins,medium interpretation risk,Separate covered workers and firms from those outside the legal margin.
formalization_assistance_enforcement,de Andrade-Bruhn-McKenzie 2016,formalization_compliance,"randomized information, assistance, and enforcement pressure",registration and compliance behavior,low private benefit of formal compliance,worker_coverage,registration gains versus worker-protection gains,high interpretation risk,"Ask whether registration changes benefits, credit, procurement, or worker coverage."
pay_transparency_gender_gap,Baker et al. 2023,pay_transparency,coverage threshold or mandate timing,"wage gaps, pay compression, bargaining",scope and salience of disclosed information,equilibrium_spillovers,"inequality, pay compression, and average wage growth",medium interpretation risk,"Track which pay, procedure, or comparison information is actually disclosed."
public_employment_service_rollout,Dustmann et al. 2014,administrative_reform,regional rollout or bundled reform timing,"job-finding, unemployment duration, wages",administrative delivery and agency quality,policy_bundling,"matching quality, benefit transitions, and incidence",high interpretation risk,Name the agency task and test whether service quality changed.
